"Specification","Recommended_role","Paper_location","Keep","Key_result","Diagnostic_status","Publication_decision"
"M1: INR-denominated oil ADL(p,3)","Main headline CPI specification","Main text","YES","CPT+=0.0213 (p=0.1220); CPT-=0.0006 (p=0.9375); asym p=0.2408","HAC-RESET p=0.1827; Rec-CUSUM p=0.0910; OLS-CUSUM p=0.3876; BG(12) p=0.0728","Use as the conservative headline model. Do not claim 5% asymmetry; say positive pass-through is suggestive and asymmetry is weak."
"M2: Brent plus exchange-rate decomposition ADL(p,3)","Robustness/decomposition","Robustness section","YES, with caution","CPT+=0.0275 (p=0.0933); CPT-=-0.0021 (p=0.7792); asym p=0.1443","HAC-RESET p=0.0128; Rec-CUSUM p=0.0337; OLS-CUSUM p=0.4061; BG(12) p=0.1563","Do not call this the primary model. Use it to show that separating Brent and INR/USD gives a larger but diagnostic-risk positive coefficient."
"M2-AIC0: Brent plus exchange rate, q=0","AIC benchmark","Appendix/robustness","YES","CPT+=-0.0025 (p=0.7036); CPT-=0.0061; asym p=0.3731","AIC-best and diagnostic-safer, but oil pass-through is negative/weak","Report for transparency; do not use for the substantive oil pass-through claim."
"M3: Brent plus exchange-rate deregulation interaction","Regime-change evidence only","Appendix or short robustness paragraph","LIMITED","Regime test p=0.0165; post-dereg CPT+=-0.0078; asym p=0.4532","HAC-RESET p=0.0000; Rec-CUSUM p=0.0430; OLS-CUSUM p=0.5829; BG(12) p=0.1318","Use only to motivate policy-regime heterogeneity; do not use as a main pass-through estimate."
"PPAC Delhi retail petrol model","Mechanism/channel evidence","Main text mechanism section","YES","CPT+=0.3459 (p=<0.001); CPT-=0.1912 (p=<0.001); asym p=0.0999","Direct channel; diagnostics checked in table_26 when model object is available","This is the strongest publishable mechanism result."
"CPI Fuel and Light model","Mechanism/channel evidence","Main text or appendix","YES","CPT+=0.0608 (p=0.0337); CPT-=0.0108 (p=0.6649); asym p=0.2647","Sub-index channel; diagnostics checked in table_26 when model object is available","Use to show attenuation from retail fuel to the CPI basket."
"NARDL A/B","Not a claim-bearing model","Appendix only, or remove","NO for main claims","ECT valid: A=NO; B=NO","Positive ECT means the ECM interpretation is invalid","Do not present long-run NARDL pass-through or dynamic multipliers as evidence."
